{
  "resultVersion": "1.0.0",
  "resultSha256": "663908be2f278470f713c06e4106cef363b919083e521d871c81623bd5a0c13c",
  "admissionResultId": "industrial-vision-media-ai-spine-admission-v1",
  "contractId": "portfolio-admission-v1",
  "contractSha256": "57d87c3c5e6b4b9933e22796ece0b5a48ed7bb7ef9adae9af8a095f537f8fbcb",
  "candidateId": "industrial-vision-media-ai-spine-v1",
  "disposition": "prototype",
  "rationale": "Keep this as a non-public prototype: deterministic architecture evidence and all blocking admission answers pass, while the existing public packet supports only a market hypothesis and the custom model remains outside the Expanso boundary.",
  "verifiedAt": "2026-07-18T12:30:00.000Z",
  "answers": [
    {
      "questionId": "Q1",
      "outcome": "PASS",
      "answer": "It proves that an edge operator can retain synthetic raw-media payloads locally while a modeled Expanso policy escalates only selected evidence and explicit model-adapter failures.",
      "evidenceRefs": ["value-oracle", "public-market-hypothesis-binding"]
    },
    {
      "questionId": "Q2",
      "outcome": "PASS",
      "answer": "It links Filter Severity, Content Splitting, and Fan-Out as primitives instead of replacing them, and the same policy package is replayed against a bounded utility-damage fixture.",
      "evidenceRefs": ["existing-primitive-links", "reuse-scenario"]
    },
    {
      "questionId": "Q3",
      "outcome": "PASS",
      "answer": "Expanso is central to local event shaping, allowlisting, escalation policy, and routing; the custom model owns inference, labels, scores, and evidence extraction.",
      "evidenceRefs": ["component-boundary", "prototype-checkpoints"]
    },
    {
      "questionId": "Q4",
      "outcome": "PASS",
      "answer": "The prototype labels Expanso policy, the camera/model adapter, custom inference, and external capture, receiving, and control-loop systems as separate components.",
      "evidenceRefs": ["component-boundary"]
    },
    {
      "questionId": "Q5",
      "outcome": "PASS",
      "answer": "The core replay is local TypeScript with checked-in JSON and requires neither credentials, paid APIs, nor network access after dependencies are installed.",
      "evidenceRefs": ["offline-reproduction"]
    },
    {
      "questionId": "Q6",
      "outcome": "PASS",
      "answer": "A pinned generator and deterministic seed produce two synthetic scenario packs and byte-stable expected checkpoints.",
      "evidenceRefs": ["prototype-source", "prototype-checkpoints"]
    },
    {
      "questionId": "Q7",
      "outcome": "PASS",
      "answer": "The checkpoints expose selected-evidence egress, raw-media retention, below-threshold local retention, and CUSTOM_MODEL_UNAVAILABLE at the custom-model boundary.",
      "evidenceRefs": ["failure-boundary", "prototype-checkpoints"]
    },
    {
      "questionId": "Q8",
      "outcome": "PASS",
      "answer": "The 30-second oracle names the local-versus-emitted decision and points directly to the decision, rawMediaBytesMoved, and cloudEvent fields.",
      "evidenceRefs": ["value-oracle"]
    },
    {
      "questionId": "Q9",
      "outcome": "PASS",
      "answer": "After repository prerequisites, one offline command validates the source, runs the policy, and compares exact checkpoint bytes.",
      "evidenceRefs": ["offline-reproduction"]
    },
    {
      "questionId": "Q10",
      "outcome": "PASS",
      "answer": "The data-rights declaration binds generated synthetic descriptors and checkpoints to the repository policy, exact generator, seed, fixture digest, and allowed redistribution verdict.",
      "evidenceRefs": ["data-rights"]
    },
    {
      "questionId": "Q11",
      "outcome": "PASS",
      "answer": "Every byte count, threshold, score, and total is an exact synthetic fixture input or deterministic replay calculation; the result excludes accuracy, adoption, and product-execution claims.",
      "evidenceRefs": ["numeric-replay", "component-boundary"]
    },
    {
      "questionId": "Q12",
      "outcome": "PASS",
      "answer": "Distinct producer and verifier lane assignments cover technical replay and editorial claim checks. This artifact proves configuration separation only; it does not attest independent execution.",
      "evidenceRefs": ["configured-review-lanes"]
    }
  ],
  "publicMarketEvidence": {
    "evidenceId": "public-market-hypothesis-packet-20260718-v2",
    "gateId": "public-market-hypothesis-packet",
    "recordDigest": "sha256:ee445dc659c233ed9391be33992e4f9889066e8e36af5fb462cf5cc3fa53138c",
    "subjectInputDigest": "sha256:d9e44bdee8f8e5cc9af45d15d95637b08f8229251355339f2c5c27d300d9a5df",
    "verificationPolicyDigest": "sha256:6530a360e4cb4e78ca52c9785a1a0f2cda75d6af4f64a301446307d3a5e7150e",
    "reproductionDigest": "sha256:47fe4d529bafe6ece494b691a1b44e8ff5451d5140460e57d510c3087d2c3012",
    "rerunVerdict": "PASS",
    "validUntil": "2027-07-17T23:59:59.000Z",
    "admissionScope": "hypothesis-only"
  },
  "artifactBindings": {
    "source": {
      "path": "tests/prototypes/industrial-vision/source-v1.json",
      "sha256": "sha256:43322c81cbd38006483deb133719ef06c646600a5b0462a48c953fae13076c91"
    },
    "checkpoints": {
      "path": "tests/prototypes/industrial-vision/checkpoints-v1.json",
      "sha256": "sha256:ef1ffbca5706098ded40bf0aaac039290a7ede04277c2be696b8c811e748b7e6"
    },
    "dataRights": {
      "path": "tests/prototypes/industrial-vision/data-rights-v1.json",
      "sha256": "sha256:4414a28416f5a094da097b8f786f2a7ad4e930361fe4637567016b4b9dcb3439"
    },
    "generator": {
      "path": "scripts/portfolio/industrial-vision-prototype.ts",
      "sha256": "sha256:f5614d99d4a2709d6e44ac9db3d22d054f262cb2d300980dd4eb6a7a43c112fa"
    }
  },
  "valueOracle": {
    "maxSeconds": 30,
    "summary": "Keep raw media at the edge; emit only selected evidence or an explicit custom-model boundary failure.",
    "inspectableFields": [
      "decision",
      "rawMediaBytesMoved",
      "cloudEvent",
      "kind"
    ]
  },
  "offlineReproduction": {
    "command": "npx tsx scripts/portfolio/industrial-vision-prototype.ts",
    "credentialsRequired": false,
    "networkRequired": false
  },
  "configuredReviewLanes": {
    "producer": {
      "id": "portfolio-prototype-execution-v1",
      "evidenceScopes": ["technical", "editorial"]
    },
    "verifier": {
      "id": "portfolio-admission-review-v1",
      "evidenceScopes": ["technical", "editorial"]
    }
  },
  "decisionSignals": {
    "rejectReasons": [],
    "reframeCurrentExample": null
  },
  "publicationGuard": {
    "publicRoute": false,
    "catalogRecord": false,
    "marketPriorityClaim": false,
    "state": "test-only"
  }
}
